story,supporting_analyses,contradicting_analyses,sample_size,robustness,dependence_on_definitions,strongest_figure,additional_analysis_needed,current_evidence_rating,manuscript_potential
Wildfires converge on a common terminal climate.,terminal secondary analysis,wide terminal tmmx/VPD/wind spread; censored terminal records,25,low,high,13_terminal_secondary_analysis,true cessation data; expanded sample; boundary climate,unsupported with current data,low now
Wildfires share a common transition out of their final expansion pulse.,alignment comparison; final meaningful expansion events,gaps and varying quiescence persistence,25,medium,medium,04_alignment_comparison_grid,test pulse thresholds on larger sample,suggestive,moderate
Wildfires exhibit recurring geometric developmental trajectories.,profiles; event table; clustering,cluster silhouette max 0.48,25,medium-low,medium,07_geometry_clustering,stability with more fires,suggestive,moderate
Wildfire development lies along continuous geometric axes rather than discrete types.,PCA loadings and scores,small sample size,25,medium,medium,08_continuous_axes_pca,functional PCA and outlier sensitivity,moderate descriptive evidence,high
Expansion pulses are associated with specific environmental states or changes.,event-centered climate extraction,"daily time step, nearest-grid-cell climate, limited pulse count",73,low-medium,high,09_event_centered_climate,larger sample; boundary climate; hourly wind optional,suggestive,moderate after expansion
Different climate variables play distinct temporal roles in wildfire development.,environmental roles diagnostics,daily records smooth short wind events,25,low-medium,medium,10_environmental_roles,more events and subdaily wind if needed,suggestive,moderate
Observation gaps prevent reliable inference about physical fire cessation.,observational raster; task-specific QC,none in current cache,25,high,low,01_observational_structure_raster,independent cessation observations,strong descriptive evidence,high as limitation/design point
